{
    "$schema": "https://raw.githubusercontent.com/iirinc/nsopw-api-schema/main/v1.0/json/schema/query.schema.json",
    "id": "000000-0000-0000-00000000000",
    "maxResults": 300,
    "firstName": null,
    "lastName": null,
    "city": null,
    "county": null,
    "zips": [
      "30047",
      "30334"
    ],
    "longitude": null,
    "latitude": null,
    "distance": null,
    "jurisdictions": [
      "GA"
    ]
  }